{
  "schemaVersion": "1.0.0",
  "id": "chapter-743e",
  "number": "743e",
  "name": "Rainchecks",
  "title": {
    "id": "title-42",
    "number": "42",
    "name": "Business, Selling, Trading and Collection Practices"
  },
  "sourceUrl": "https://www.cga.ct.gov/current/pub/chap_743e.htm",
  "sections": [
    {
      "id": "section-42-215",
      "kind": "section",
      "citation": "42-215",
      "citations": [
        "42-215"
      ],
      "heading": "Sec. 42-215. Sale at discount to include raincheck. Exemptions. Notice. Comparable merchandise.",
      "sourceUrl": "https://www.cga.ct.gov/current/pub/chap_743e.htm#sec_42-215",
      "status": "active",
      "content": {
        "body": [
          "(a) No person, firm, corporation, partnership or association shall sell, offer for sale or advertise items of merchandise for sale at a discount from the normal retail price without offering a written voucher, commonly referred to as a “rain check”, for sale items which become out of stock during an advertised sale period unless: (1) Such items are motor vehicles; (2) such items are clothing or footwear, which are seasonal in nature and the stock of which cannot be replenished or which are sized to fit; (3) such discount is applicable throughout a store or throughout any department in a store; (4) all advertisements for sale clearly indicate the quantity of items available at the sale price and clearly state that no rain checks are offered; (5) such items are alcoholic beverages; (6) such items are offered for sale as part of a clearance, permanent markdown or closeout sale; or (7) a customer accepts a comparable discount on a comparable item.",
          "(b) The holder of a rain check shall be notified by the issuer when the sale item is in stock and shall have at least ten days after notification to purchase the item at the sale price, except that a retail food store shall not be required to notify such holder when the sale item is in stock. No person shall be entitled to receive a greater number of rain checks per item than is allowed under the retailer's advertised limit. If a rain check is not redeemed by the retailer within sixty days after its issuance, the retailer shall offer the holder of a rain check similar or comparable merchandise at or below the advertised sale price of the merchandise which was the subject of the sale. If the holder of a rain check wishes to purchase such similar or comparable merchandise, he shall do so within ten days of the retailer's offer to substitute comparable merchandise."
        ],
        "sourceNotes": [
          "(P.A. 86-302, S. 2.)"
        ],
        "history": [],
        "annotations": [],
        "plainText": "(a) No person, firm, corporation, partnership or association shall sell, offer for sale or advertise items of merchandise for sale at a discount from the normal retail price without offering a written voucher, commonly referred to as a “rain check”, for sale items which become out of stock during an advertised sale period unless: (1) Such items are motor vehicles; (2) such items are clothing or footwear, which are seasonal in nature and the stock of which cannot be replenished or which are sized to fit; (3) such discount is applicable throughout a store or throughout any department in a store; (4) all advertisements for sale clearly indicate the quantity of items available at the sale price and clearly state that no rain checks are offered; (5) such items are alcoholic beverages; (6) such items are offered for sale as part of a clearance, permanent markdown or closeout sale; or (7) a customer accepts a comparable discount on a comparable item.\n\n(b) The holder of a rain check shall be notified by the issuer when the sale item is in stock and shall have at least ten days after notification to purchase the item at the sale price, except that a retail food store shall not be required to notify such holder when the sale item is in stock. No person shall be entitled to receive a greater number of rain checks per item than is allowed under the retailer's advertised limit. If a rain check is not redeemed by the retailer within sixty days after its issuance, the retailer shall offer the holder of a rain check similar or comparable merchandise at or below the advertised sale price of the merchandise which was the subject of the sale. If the holder of a rain check wishes to purchase such similar or comparable merchandise, he shall do so within ten days of the retailer's offer to substitute comparable merchandise."
      }
    },
    {
      "id": "section-42-216",
      "kind": "section",
      "citation": "42-216",
      "citations": [
        "42-216"
      ],
      "heading": "Sec. 42-216. Regulations.",
      "sourceUrl": "https://www.cga.ct.gov/current/pub/chap_743e.htm#sec_42-216",
      "status": "active",
      "content": {
        "body": [
          "The Commissioner of Consumer Protection may adopt regulations in accordance with the provisions of chapter 54 in order to carry out the provisions of this chapter."
        ],
        "sourceNotes": [
          "(P.A. 86-302, S. 3; June 30 Sp. Sess. P.A. 03-6, S. 146(c); P.A. 04-189, S. 1.)"
        ],
        "history": [
          "History: June 30 Sp. Sess. P.A. 03-6 replaced Commissioner of Consumer Protection with Commissioner of Agriculture and Consumer Protection, effective July 1, 2004; P.A. 04-189 repealed Sec. 146 of June 30 Sp. Sess. P.A. 03-6, thereby reversing the merger of the Departments of Agriculture and Consumer Protection, effective June 1, 2004."
        ],
        "annotations": [],
        "plainText": "The Commissioner of Consumer Protection may adopt regulations in accordance with the provisions of chapter 54 in order to carry out the provisions of this chapter."
      }
    },
    {
      "id": "section-42-217",
      "kind": "section",
      "citation": "42-217",
      "citations": [
        "42-217"
      ],
      "heading": "Sec. 42-217. Penalties. Defenses.",
      "sourceUrl": "https://www.cga.ct.gov/current/pub/chap_743e.htm#sec_42-217",
      "status": "active",
      "content": {
        "body": [
          "(a) A violation of any of the provisions of this chapter shall be deemed an unfair or deceptive trade practice under chapter 735a.",
          "(b) It shall be a defense to any charge brought in accordance with the provisions of chapter 735a, concerning unfair trade practices, pursuant to subsection (a) of this section, that a retailer ordered the advertised merchandise which was the subject of the sale, in adequate time for delivery and such merchandise was delivered to the store in quantities sufficient to meet reasonably anticipated demand for such merchandise.",
          "(c) The defense provided for in subsection (b) of this section shall not relieve a retailer of the obligation to offer a rain check or comparable or similar merchandise to consumers in accordance with the provisions of section 42-215 ."
        ],
        "sourceNotes": [
          "(P.A. 86-302, S. 4.)"
        ],
        "history": [],
        "annotations": [],
        "plainText": "(a) A violation of any of the provisions of this chapter shall be deemed an unfair or deceptive trade practice under chapter 735a.\n\n(b) It shall be a defense to any charge brought in accordance with the provisions of chapter 735a, concerning unfair trade practices, pursuant to subsection (a) of this section, that a retailer ordered the advertised merchandise which was the subject of the sale, in adequate time for delivery and such merchandise was delivered to the store in quantities sufficient to meet reasonably anticipated demand for such merchandise.\n\n(c) The defense provided for in subsection (b) of this section shall not relieve a retailer of the obligation to offer a rain check or comparable or similar merchandise to consumers in accordance with the provisions of section 42-215 ."
      }
    },
    {
      "id": "group-42-218-to-42-219",
      "kind": "group",
      "citation": null,
      "citations": [
        "42-218",
        "42-219"
      ],
      "heading": "Secs. 42-218 and 42-219.",
      "sourceUrl": "https://www.cga.ct.gov/current/pub/chap_743e.htm#secs_42-218_and_42-219",
      "status": "reserved",
      "content": {
        "body": [
          "Reserved for future use."
        ],
        "sourceNotes": [],
        "history": [],
        "annotations": [],
        "plainText": "Reserved for future use."
      }
    }
  ]
}
