{
  "schemaVersion": "1.0.0",
  "id": "chapter-388a",
  "number": "388a",
  "name": "Bulk Water Haulers",
  "title": {
    "id": "title-20",
    "number": "20",
    "name": "Professional and Occupational Licensing, Certification, Title Protection and Registration. Examining Boards"
  },
  "sourceUrl": "https://www.cga.ct.gov/current/pub/chap_388a.htm",
  "sections": [
    {
      "id": "section-20-278h",
      "kind": "section",
      "citation": "20-278h",
      "citations": [
        "20-278h"
      ],
      "heading": "Sec. 20-278h. Licensure. Fee. Qualifications. Renewal. Disciplinary action. Penalty.",
      "sourceUrl": "https://www.cga.ct.gov/current/pub/chap_388a.htm#sec_20-278h",
      "status": "active",
      "content": {
        "body": [
          "(a) On and after October 1, 2014, no person shall act as a bulk water hauler unless such person has obtained a license issued by the Department of Public Health in accordance with this section. For purposes of this section: (1) “Bulk water hauling” means transporting water to a water company or a consumer of a water company, in bulk by any means, where such water is to be used for public drinking water supply purposes; (2) “bulk” means two hundred fifty gallons of water or more; (3) “consumer” has the same meaning as in section 25-32a ; (4) “water company” has the same meaning as in section 25-32a ; and (5) “commissioner” means the Commissioner of Public Health or the commissioner's designee.",
          "(b) Each person seeking licensure as a bulk water hauler shall make application on a form prescribed by the department, pay an application fee of one hundred dollars and present evidence satisfactory to the commissioner that the applicant has the qualifications necessary to engage in bulk water hauling.",
          "(c) The commissioner shall establish (1) the qualifications to obtain a license as a bulk water hauler, and (2) requirements designed to ensure that any water transported by a bulk water hauler is fit for human use and consumption.",
          "(d) Licenses shall be renewed once every two years in accordance with the provisions of section 19a-88 . The fee for renewal shall be one hundred dollars. No license shall be issued under this section to any applicant who has been the subject of professional disciplinary action relating to the hauling of bulk water in this or any other state or jurisdiction.",
          "(e) Any water transported by bulk water hauling shall meet the requirements of section 25-32 and regulations adopted thereunder. No bulk water hauler shall deliver water to a consumer of a water company without first notifying the water company of such delivery. Bulk water hauling to a water company or a consumer of a water company shall be permitted only as a temporary measure to alleviate a water supply shortage.",
          "(f) The commissioner may periodically inspect any equipment or material used in connection with bulk water hauling, may investigate any water supply from which a bulk water hauler obtains water in accordance with section 25-34 and may issue any order necessary to protect the public health. Any order issued under this subsection shall not be stayed upon any appeal by a licensee under section 25-34 or 25-36 .",
          "(g) The commissioner may adopt regulations, in accordance with the provisions of chapter 54, to implement the provisions of this section.",
          "(h) The commissioner may take any disciplinary action set forth in section 19a-17 against a bulk water hauler for any of the following reasons: (1) Fraud or deceit in obtaining or renewing a license to act as a bulk water hauler; (2) fraud or deceit in rendering services under the license; (3) negligent, incompetent or wrongful conduct in rendering services under the license; or (4) violation of any provision of this section or regulations adopted under this section. The commissioner may take action pursuant to said section 19a-17 after providing notice and an opportunity for a hearing on any contemplated action under said section 19a-17 .",
          "(i) Any person who violates any provision of this section shall, for each offense, be guilty of a class C misdemeanor."
        ],
        "sourceNotes": [
          "(P.A. 14-178, S. 1.)"
        ],
        "history": [
          "History: P.A. 14-178 effective June 11, 2014."
        ],
        "annotations": [],
        "plainText": "(a) On and after October 1, 2014, no person shall act as a bulk water hauler unless such person has obtained a license issued by the Department of Public Health in accordance with this section. For purposes of this section: (1) “Bulk water hauling” means transporting water to a water company or a consumer of a water company, in bulk by any means, where such water is to be used for public drinking water supply purposes; (2) “bulk” means two hundred fifty gallons of water or more; (3) “consumer” has the same meaning as in section 25-32a ; (4) “water company” has the same meaning as in section 25-32a ; and (5) “commissioner” means the Commissioner of Public Health or the commissioner's designee.\n\n(b) Each person seeking licensure as a bulk water hauler shall make application on a form prescribed by the department, pay an application fee of one hundred dollars and present evidence satisfactory to the commissioner that the applicant has the qualifications necessary to engage in bulk water hauling.\n\n(c) The commissioner shall establish (1) the qualifications to obtain a license as a bulk water hauler, and (2) requirements designed to ensure that any water transported by a bulk water hauler is fit for human use and consumption.\n\n(d) Licenses shall be renewed once every two years in accordance with the provisions of section 19a-88 . The fee for renewal shall be one hundred dollars. No license shall be issued under this section to any applicant who has been the subject of professional disciplinary action relating to the hauling of bulk water in this or any other state or jurisdiction.\n\n(e) Any water transported by bulk water hauling shall meet the requirements of section 25-32 and regulations adopted thereunder. No bulk water hauler shall deliver water to a consumer of a water company without first notifying the water company of such delivery. Bulk water hauling to a water company or a consumer of a water company shall be permitted only as a temporary measure to alleviate a water supply shortage.\n\n(f) The commissioner may periodically inspect any equipment or material used in connection with bulk water hauling, may investigate any water supply from which a bulk water hauler obtains water in accordance with section 25-34 and may issue any order necessary to protect the public health. Any order issued under this subsection shall not be stayed upon any appeal by a licensee under section 25-34 or 25-36 .\n\n(g) The commissioner may adopt regulations, in accordance with the provisions of chapter 54, to implement the provisions of this section.\n\n(h) The commissioner may take any disciplinary action set forth in section 19a-17 against a bulk water hauler for any of the following reasons: (1) Fraud or deceit in obtaining or renewing a license to act as a bulk water hauler; (2) fraud or deceit in rendering services under the license; (3) negligent, incompetent or wrongful conduct in rendering services under the license; or (4) violation of any provision of this section or regulations adopted under this section. The commissioner may take action pursuant to said section 19a-17 after providing notice and an opportunity for a hearing on any contemplated action under said section 19a-17 .\n\n(i) Any person who violates any provision of this section shall, for each offense, be guilty of a class C misdemeanor."
      }
    }
  ]
}
