{
  "schemaVersion": "1.0.0",
  "id": "chapter-483c",
  "number": "483c",
  "name": "Bi-State Farmington River Commission",
  "title": {
    "id": "title-25",
    "number": "25",
    "name": "Water Resources. Flood and Erosion Control"
  },
  "sourceUrl": "https://www.cga.ct.gov/current/pub/chap_483c.htm",
  "sections": [
    {
      "id": "group-25-175-to-25-176-to-25-177",
      "kind": "group",
      "citation": null,
      "citations": [
        "25-175",
        "25-176",
        "25-177"
      ],
      "heading": "Secs. 25-175 to 25-177. Establishment of commission; membership. Duties of commission; report. Effective date.",
      "sourceUrl": "https://www.cga.ct.gov/current/pub/chap_483c.htm#secs_25-175_to_25-177",
      "status": "repealed",
      "content": {
        "body": [
          "Sections 25-175 to 25-177 , inclusive, are repealed, effective July 1, 2013."
        ],
        "sourceNotes": [
          "(P.A. 90-341, S. 6, 7, 11, 14; P.A. 11-80, S. 1; P.A. 13-299, S. 95.)"
        ],
        "history": [],
        "annotations": [],
        "plainText": "Sections 25-175 to 25-177 , inclusive, are repealed, effective July 1, 2013."
      }
    },
    {
      "id": "section-25-178",
      "kind": "section",
      "citation": "25-178",
      "citations": [
        "25-178"
      ],
      "heading": "Sec. 25-178.",
      "sourceUrl": "https://www.cga.ct.gov/current/pub/chap_483c.htm#sec_25-178",
      "status": "transferred",
      "content": {
        "body": [
          "Transferred to Chapter 483aa, Sec. 25-199b ."
        ],
        "sourceNotes": [],
        "history": [],
        "annotations": [],
        "plainText": "Transferred to Chapter 483aa, Sec. 25-199b ."
      }
    },
    {
      "id": "group-25-179-to-25-180-to-25-181-to-25-182-to-25-183-to-25-184-to-25-185-to-25-186-to-25-187-to-25-188-to-25-189-to-25-190-to-25-191-to-25-192-to-25-193-to-25-194-to-25-195-to-25-196-to-25-197-to-25-198",
      "kind": "group",
      "citation": null,
      "citations": [
        "25-179",
        "25-180",
        "25-181",
        "25-182",
        "25-183",
        "25-184",
        "25-185",
        "25-186",
        "25-187",
        "25-188",
        "25-189",
        "25-190",
        "25-191",
        "25-192",
        "25-193",
        "25-194",
        "25-195",
        "25-196",
        "25-197",
        "25-198"
      ],
      "heading": "Secs. 25-179 to 25-198.",
      "sourceUrl": "https://www.cga.ct.gov/current/pub/chap_483c.htm#secs_25-179_to_25-198",
      "status": "reserved",
      "content": {
        "body": [
          "Reserved for future use.",
          "Note: Chapters 483d to 483z are also reserved for future use."
        ],
        "sourceNotes": [],
        "history": [],
        "annotations": [],
        "plainText": "Reserved for future use.\n\nNote: Chapters 483d to 483z are also reserved for future use."
      }
    },
    {
      "id": "section-25-175",
      "kind": "section",
      "citation": "25-175",
      "citations": [
        "25-175"
      ],
      "heading": "25-175",
      "sourceUrl": "https://www.cga.ct.gov/current/pub/chap_483c.htm#sec_25-175",
      "status": "repealed",
      "content": {
        "body": [
          "Secs. 25-175 to 25-177. Establishment of commission; membership. Duties of commission; report. Effective date. Sections 25-175 to 25-177 , inclusive, are repealed, effective July 1, 2013."
        ],
        "sourceNotes": [],
        "history": [],
        "annotations": [],
        "plainText": "Secs. 25-175 to 25-177. Establishment of commission; membership. Duties of commission; report. Effective date. Sections 25-175 to 25-177 , inclusive, are repealed, effective July 1, 2013."
      }
    },
    {
      "id": "section-25-177",
      "kind": "section",
      "citation": "25-177",
      "citations": [
        "25-177"
      ],
      "heading": "25-177",
      "sourceUrl": "https://www.cga.ct.gov/current/pub/chap_483c.htm#sec_25-177",
      "status": "repealed",
      "content": {
        "body": [
          "Secs. 25-175 to 25-177. Establishment of commission; membership. Duties of commission; report. Effective date. Sections 25-175 to 25-177 , inclusive, are repealed, effective July 1, 2013."
        ],
        "sourceNotes": [],
        "history": [],
        "annotations": [],
        "plainText": "Secs. 25-175 to 25-177. Establishment of commission; membership. Duties of commission; report. Effective date. Sections 25-175 to 25-177 , inclusive, are repealed, effective July 1, 2013."
      }
    }
  ]
}
